{
  "$schema": "http://json-schema.org/draft-07/schema#",
  "$id": "https://ai-platform-data/schemas/taxonomy_registry.schema.json",
  "title": "Taxonomy Registry Schema",
  "description": "JSON Schema for the taxonomy registry. Provides a discovery mechanism for available taxonomies, allowing users to select which taxonomy to use at runtime.",
  "type": "object",
  "required": ["registry_version", "default_taxonomy", "taxonomies"],
  "additionalProperties": false,
  "properties": {
    "registry_version": {
      "type": "string",
      "description": "Semantic version of the registry format",
      "pattern": "^[0-9]+\\.[0-9]+\\.[0-9]+$"
    },
    "default_taxonomy": {
      "type": "string",
      "description": "ID of the default taxonomy to use if none specified. User can override this at runtime.",
      "minLength": 1
    },
    "description": {
      "type": "string",
      "description": "Description of the registry purpose"
    },
    "taxonomies": {
      "type": "array",
      "description": "List of available taxonomies for user selection",
      "minItems": 1,
      "items": {
        "$ref": "#/definitions/taxonomy_entry"
      }
    }
  },
  "definitions": {
    "taxonomy_entry": {
      "type": "object",
      "description": "Metadata for a taxonomy available in the registry",
      "required": ["id", "name", "version", "path"],
      "additionalProperties": false,
      "properties": {
        "id": {
          "type": "string",
          "description": "Unique identifier for the taxonomy (e.g., 'ai-ml-2024', 'domain-v1')",
          "minLength": 1,
          "pattern": "^[a-z0-9-]+$"
        },
        "name": {
          "type": "string",
          "description": "Human-readable name of the taxonomy",
          "minLength": 1
        },
        "version": {
          "type": "string",
          "description": "Semantic version of the taxonomy",
          "pattern": "^[0-9]+\\.[0-9]+\\.[0-9]+$"
        },
        "path": {
          "type": "string",
          "description": "Relative path to the taxonomy file from taxonomies/ directory",
          "minLength": 1
        },
        "description": {
          "type": "string",
          "description": "Brief description of the taxonomy's purpose and scope"
        },
        "tier_count": {
          "type": "integer",
          "description": "Number of tiers in the taxonomy",
          "minimum": 0
        },
        "book_count": {
          "type": "integer",
          "description": "Total number of books referenced in the taxonomy",
          "minimum": 0
        },
        "domains": {
          "type": "array",
          "description": "List of domains covered by this taxonomy",
          "items": {
            "type": "string"
          }
        },
        "created_at": {
          "type": "string",
          "description": "ISO 8601 timestamp of when taxonomy was created",
          "format": "date"
        },
        "updated_at": {
          "type": "string",
          "description": "ISO 8601 timestamp of last update",
          "format": "date"
        },
        "active": {
          "type": "boolean",
          "description": "Whether this taxonomy is active and available for selection",
          "default": true
        }
      }
    }
  }
}
